"B0D643DKJW","Coleman Brazos 20/30°F Adult Cool-Weather Sleeping Bag with No-Snag Zipper & Stuff Sack, Machine Washable","US","amz-B0D7QHY574","fetched","Coleman Brazos 20/30°F Adult Cool-Weather Sleeping Bag with No-Snag Zipper & Stuff Sack, Machine Washable","","[""Stay warm in temperatures as low as 20°F"",""For campers up to 5 ft. 11 in"",""Thermolock draft tube along the zipper keeps body heat from escaping"",""Fiberlock construction keeps insulation from shifting"",""Easier packing with fasteners that lock bag in place as you roll"",""Stuff sack included"",""No-snag zipper"",""Zip 2 bags together for double the room"",""Measures 75 x 33 in"",""Machine washable for easy cleaning""]","","B0D643DKJW","[{""ContextFreeName"":""Camping Sleeping Bags"",""DisplayName"":""Sleeping Bags"",""Id"":""2204498011"",""IsRoot"":false},{""ContextFreeName"":""Get ready for camping"",""DisplayName"":""Get ready for camping"",""Id"":""205671833011"",""IsRoot"":false},{""ContextFreeName"":""Camp Sleep"",""DisplayName"":""Camp Sleep"",""Id"":""23566368011"",""IsRoot"":false},{""ContextFreeName"":""Coleman PBDD"",""DisplayName"":""Coleman PBDD"",""Id"":""212323255011"",""IsRoot"":false},{""ContextFreeName"":""Outdoors PBDD"",""DisplayName"":""Outdoors PBDD"",""Id"":""212329392011"",""IsRoot"":false},{""ContextFreeName"":""Camping & Hiking"",""DisplayName"":""Camping & Hiking"",""Id"":""207963343011"",""IsRoot"":false}]","https://www.amazon.com/dp/B0D643DKJW?tag=smartymode-20&linkCode=ogi&th=1&psc=1","https://m.media-amazon.com/images/I/31ZzAYEc8rL._SL75_.jpg",75,75,"https://m.media-amazon.com/images/I/31ZzAYEc8rL._SL160_.jpg",160,160,"https://m.media-amazon.com/images/I/31ZzAYEc8rL._SL500_.jpg",500,500,"[{""Small"":{""URL"":""https://m.media-amazon.com/images/I/31ewr+k7y1L._SL75_.jpg"",""Height"":49,""Width"":75}},{""Small"":{""URL"":""https://m.media-amazon.com/images/I/311gN-PWfrL._SL75_.jpg"",""Height"":49,""Width"":75}},{""Small"":{""URL"":""https://m.media-amazon.com/images/I/41iFpR80igL._SL75_.jpg"",""Height"":49,""Width"":75}},{""Small"":{""URL"":""https://m.media-amazon.com/images/I/41zY1lbIxKL._SL75_.jpg"",""Height"":49,""Width"":75}},{""Small"":{""URL"":""https://m.media-amazon.com/images/I/41EX3z725VL._SL75_.jpg"",""Height"":49,""Width"":75}},{""Small"":{""URL"":""https://m.media-amazon.com/images/I/31xzi9sHYPL._SL75_.jpg"",""Height"":75,""Width"":49}}]","[""Stay warm in temperatures as low as 20°F"",""For campers up to 5 ft. 11 in"",""Thermolock draft tube along the zipper keeps body heat from escaping"",""Fiberlock construction keeps insulation from shifting"",""Easier packing with fasteners that lock bag in place as you roll"",""Stuff sack included"",""No-snag zipper"",""Zip 2 bags together for double the room"",""Measures 75 x 33 in"",""Machine washable for easy cleaning""]","Features","en_US","Blue","Color","en_US",,,,3,"Height","en_US","Inches",17.1,"Length","en_US","Inches",5.3,"Weight","en_US","Pounds",10.2,"Width","en_US","Inches","PFAS-Free","Size","en_US",1,"NumberOfItems","en_US","Coleman Brazos 20/30°F Adult Cool-Weather Sleeping Bag with No-Snag Zipper & Stuff Sack, Machine Washable","Title","en_US","[{""Availability"":{""Message"":""In Stock""},""Condition"":{""Value"":""New""},""Id"":""xy8emgsS8O9j43Tq0R%2B2XwGodMRRVeHe0HJJzX02HXNzfuWvqRBUY1Q6D4Bj8X0xkn8%2FxosFs3YzrvOHtOp7Hc4GsjY%2F1lLDQVv3lM7jtfkCnz3YOjMsCidjcrOMDLWwZR4mQgcmMUqzddZ%2BHSJWWA%3D%3D"",""Price"":{""Amount"":47.19,""Currency"":""USD"",""DisplayAmount"":""$47.19"",""Savings"":{""Amount"":11.8,""Currency"":""USD"",""DisplayAmount"":""$11.80 (20%)"",""Percentage"":20}},""ViolatesMAP"":false}]","[{""Condition"":{""Value"":""Used""},""HighestPrice"":{""Amount"":41.52,""Currency"":""USD"",""DisplayAmount"":""$41.52""}},{""Condition"":{""Value"":""New""},""HighestPrice"":{""Amount"":81.27,""Currency"":""USD"",""DisplayAmount"":""$81.27""}}]","B0DHJL8CMJ",,"2025-12-29T15:40:50.602Z",,"https://m.media-amazon.com/images/I/31ZzAYEc8rL._SL75_.jpg","https://m.media-amazon.com/images/I/31ZzAYEc8rL._SL160_.jpg","https://m.media-amazon.com/images/I/31ZzAYEc8rL._SL500_.jpg","47.19","",,,"[{""ContextFreeName"":""Camping Sleeping Bags"",""DisplayName"":""Sleeping Bags"",""Id"":""2204498011"",""IsRoot"":false},{""ContextFreeName"":""Get ready for camping"",""DisplayName"":""Get ready for camping"",""Id"":""205671833011"",""IsRoot"":false},{""ContextFreeName"":""Camp Sleep"",""DisplayName"":""Camp Sleep"",""Id"":""23566368011"",""IsRoot"":false},{""ContextFreeName"":""Coleman PBDD"",""DisplayName"":""Coleman PBDD"",""Id"":""212323255011"",""IsRoot"":false},{""ContextFreeName"":""Outdoors PBDD"",""DisplayName"":""Outdoors PBDD"",""Id"":""212329392011"",""IsRoot"":false},{""ContextFreeName"":""Camping & Hiking"",""DisplayName"":""Camping & Hiking"",""Id"":""207963343011"",""IsRoot"":false}]","{}","Blue","Color","en_US",,,,3,"Height","en_US","Inches",17.1,"Length","en_US","Inches",5.3,"Weight","en_US","Pounds",10.2,"Width","en_US","Inches","PFAS-Free","Size","en_US",1,"NumberOfItems","en_US","USD","In Stock",,"B0DHJL8CMJ",,,,,,,,,,,,,,,
"B00339912S","Coleman Pack-Away Portable Camp Kitchen, Outdoor Folding Kitchen with Food Prep Area, Great for Camping, Tailgating, Grilling & More","US","amz-B0D7QHY574","fetched","Coleman Pack-Away Portable Camp Kitchen, Outdoor Folding Kitchen with Food Prep Area, Great for Camping, Tailgating, Grilling & More","","[""31.5 x 21.3-inch food prep area ideal for chopping ingredients"",""27.8 x 20.5-inch side table accommodates most Coleman stoves and coolers"",""Handy utensil hooks and mesh shelf provide additional storage space"",""Folding design fits into a compact case for easy carrying and storage"",""Portable camp kitchen offers a stable cooking surface and ample storage space"",""Convenient travel-friendly: Frame collapses and prep surface turns into integrated storage case"",""Multi-use: Perfect for Camping, Tailgating, or Backyard Barbecues""]","","B00339912S","[{""ContextFreeName"":""Camping Tables"",""DisplayName"":""Tables"",""Id"":""3400841"",""IsRoot"":false},{""ContextFreeName"":""Coleman Holiday Gift Ideas"",""DisplayName"":""Coleman Holiday Gift Ideas"",""Id"":""7435082011"",""IsRoot"":false},{""ContextFreeName"":""Tailgate Outdoors"",""DisplayName"":""Tailgate Outdoors"",""Id"":""7461992011"",""IsRoot"":false},{""ContextFreeName"":""Winter Storm Preparation"",""DisplayName"":""Winter Storm Preparation"",""Id"":""7437575011"",""IsRoot"":false},{""ContextFreeName"":""Customers' Most-Loved Outdoors"",""DisplayName"":""Customers' Most-Loved Outdoors"",""Id"":""23946852011"",""IsRoot"":false},{""ContextFreeName"":""BYOC Customers' Most-Loved: Outdoors"",""DisplayName"":""BYOC Customers' Most-Loved: Outdoors"",""Id"":""122177604011"",""IsRoot"":false},{""ContextFreeName"":""Customers' Most-Loved: Outdoors"",""DisplayName"":""Customers' Most-Loved: Outdoors"",""Id"":""21596633011"",""IsRoot"":false},{""ContextFreeName"":""Most-loved deals on outdoors"",""DisplayName"":""Most-loved deals on outdoors"",""Id"":""119186725011"",""IsRoot"":false},{""ContextFreeName"":""S&O CML"",""DisplayName"":""S&O CML"",""Id"":""82491824011"",""IsRoot"":false},{""ContextFreeName"":""CML Placeholder Outdoor"",""DisplayName"":""CML Placeholder Outdoor"",""Id"":""21586427011"",""IsRoot"":false},{""ContextFreeName"":""Citi Free Shipping Promotion"",""DisplayName"":""Citi Free Shipping Promotion"",""Id"":""7077339011"",""IsRoot"":false},{""ContextFreeName"":""Camp Furniture"",""DisplayName"":""Camp Furniture"",""Id"":""23566369011"",""IsRoot"":false},{""ContextFreeName"":""Summer Savings on Coleman Camping Gear"",""DisplayName"":""Summer Savings on Coleman Camping Gear"",""Id"":""9365992011"",""IsRoot"":false},{""ContextFreeName"":""Start Exploring"",""DisplayName"":""Start Exploring"",""Id"":""12767040011"",""IsRoot"":false},{""ContextFreeName"":""Spring Savings on Coleman Camping Gear"",""DisplayName"":""Spring Savings on Coleman Camping Gear"",""Id"":""9103512011"",""IsRoot"":false},{""ContextFreeName"":""Savings Across Coleman"",""DisplayName"":""Savings Across Coleman"",""Id"":""12114505011"",""IsRoot"":false},{""ContextFreeName"":""Great Savings on Coleman Camping & Hiking Gear"",""DisplayName"":""Great Savings on Coleman Camping & Hiking Gear"",""Id"":""9819444011"",""IsRoot"":false},{""ContextFreeName"":""Coleman PBDD"",""DisplayName"":""Coleman PBDD"",""Id"":""212323255011"",""IsRoot"":false},{""ContextFreeName"":""Outdoors PBDD"",""DisplayName"":""Outdoors PBDD"",""Id"":""212329392011"",""IsRoot"":false},{""ContextFreeName"":""Save 10% on Sports & Outdoors"",""DisplayName"":""Save 10% on Sports & Outdoors"",""Id"":""122527268011"",""IsRoot"":false},{""ContextFreeName"":""Get $25 off when you buy $200 of select Sports & Outdoors products"",""DisplayName"":""Get $25 off when you buy $200 of select Sports & Outdoors products"",""Id"":""204390938011"",""IsRoot"":false},{""ContextFreeName"":""Tailgating season"",""DisplayName"":""Tailgating season"",""Id"":""122347023011"",""IsRoot"":false},{""ContextFreeName"":""Bedding & Furniture"",""DisplayName"":""Bedding & Furniture"",""Id"":""19633559011"",""IsRoot"":false}]","https://www.amazon.com/dp/B00339912S?tag=smartymode-20&linkCode=ogi&th=1&psc=1","https://m.media-amazon.com/images/I/41Zd4cHj9fL._SL75_.jpg",75,75,"https://m.media-amazon.com/images/I/41Zd4cHj9fL._SL160_.jpg",160,160,"https://m.media-amazon.com/images/I/41Zd4cHj9fL._SL500_.jpg",500,500,"[{""Small"":{""URL"":""https://m.media-amazon.com/images/I/61zu1LRo6CL._SL75_.jpg"",""Height"":75,""Width"":70}},{""Small"":{""URL"":""https://m.media-amazon.com/images/I/41exNz6WdbL._SL75_.jpg"",""Height"":75,""Width"":49}},{""Small"":{""URL"":""https://m.media-amazon.com/images/I/61IdrGpRC2L._SL75_.jpg"",""Height"":73,""Width"":75}},{""Small"":{""URL"":""https://m.media-amazon.com/images/I/51rNYkDa9bL._SL75_.jpg"",""Height"":75,""Width"":60}}]","[""31.5 x 21.3-inch food prep area ideal for chopping ingredients"",""27.8 x 20.5-inch side table accommodates most Coleman stoves and coolers"",""Handy utensil hooks and mesh shelf provide additional storage space"",""Folding design fits into a compact case for easy carrying and storage"",""Portable camp kitchen offers a stable cooking surface and ample storage space"",""Convenient travel-friendly: Frame collapses and prep surface turns into integrated storage case"",""Multi-use: Perfect for Camping, Tailgating, or Backyard Barbecues""]","Features","en_US","Grey & White","Color","en_US",false,"IsAdultProduct","en_US",4,"Height","en_US","inches",31.5,"Length","en_US","inches",14.33,"Weight","en_US","pounds",11,"Width","en_US","inches","56 x 21.3 x 66.1 inches","Size","en_US",1,"NumberOfItems","en_US","Coleman Pack-Away Portable Camp Kitchen, Outdoor Folding Kitchen with Food Prep Area, Great for Camping, Tailgating, Grilling & More","Title","en_US","[{""Availability"":{""Message"":""In Stock""},""Condition"":{""Value"":""New""},""Id"":""ZtT567JMJFocHkHYIe2ZTFs0HZ7%2FQ9SMB5Tz8zUk9F5dEUJcE5loTftIbsxAWy2N3X46RIrThLJF8UjcBjODTiyvpEx%2FL3M0AvCctpYa%2BjZbWoo1GoA8tFjkUrWA6HWiFMiEj7NGKRs%3D"",""Price"":{""Amount"":141.49,""Currency"":""USD"",""DisplayAmount"":""$141.49""},""ViolatesMAP"":false}]","[{""Condition"":{""Value"":""Used""},""HighestPrice"":{""Amount"":92.41,""Currency"":""USD"",""DisplayAmount"":""$92.41""}},{""Condition"":{""Value"":""New""},""HighestPrice"":{""Amount"":154.4,""Currency"":""USD"",""DisplayAmount"":""$154.40""}}]","B0CBBZ3J4J",,"2025-12-29T15:42:39.107Z",,"https://m.media-amazon.com/images/I/41Zd4cHj9fL._SL75_.jpg","https://m.media-amazon.com/images/I/41Zd4cHj9fL._SL160_.jpg","https://m.media-amazon.com/images/I/41Zd4cHj9fL._SL500_.jpg","141.49","",,,"[{""ContextFreeName"":""Camping Tables"",""DisplayName"":""Tables"",""Id"":""3400841"",""IsRoot"":false},{""ContextFreeName"":""Coleman Holiday Gift Ideas"",""DisplayName"":""Coleman Holiday Gift Ideas"",""Id"":""7435082011"",""IsRoot"":false},{""ContextFreeName"":""Tailgate Outdoors"",""DisplayName"":""Tailgate Outdoors"",""Id"":""7461992011"",""IsRoot"":false},{""ContextFreeName"":""Winter Storm Preparation"",""DisplayName"":""Winter Storm Preparation"",""Id"":""7437575011"",""IsRoot"":false},{""ContextFreeName"":""Customers' Most-Loved Outdoors"",""DisplayName"":""Customers' Most-Loved Outdoors"",""Id"":""23946852011"",""IsRoot"":false},{""ContextFreeName"":""BYOC Customers' Most-Loved: Outdoors"",""DisplayName"":""BYOC Customers' Most-Loved: Outdoors"",""Id"":""122177604011"",""IsRoot"":false},{""ContextFreeName"":""Customers' Most-Loved: Outdoors"",""DisplayName"":""Customers' Most-Loved: Outdoors"",""Id"":""21596633011"",""IsRoot"":false},{""ContextFreeName"":""Most-loved deals on outdoors"",""DisplayName"":""Most-loved deals on outdoors"",""Id"":""119186725011"",""IsRoot"":false},{""ContextFreeName"":""S&O CML"",""DisplayName"":""S&O CML"",""Id"":""82491824011"",""IsRoot"":false},{""ContextFreeName"":""CML Placeholder Outdoor"",""DisplayName"":""CML Placeholder Outdoor"",""Id"":""21586427011"",""IsRoot"":false},{""ContextFreeName"":""Citi Free Shipping Promotion"",""DisplayName"":""Citi Free Shipping Promotion"",""Id"":""7077339011"",""IsRoot"":false},{""ContextFreeName"":""Camp Furniture"",""DisplayName"":""Camp Furniture"",""Id"":""23566369011"",""IsRoot"":false},{""ContextFreeName"":""Summer Savings on Coleman Camping Gear"",""DisplayName"":""Summer Savings on Coleman Camping Gear"",""Id"":""9365992011"",""IsRoot"":false},{""ContextFreeName"":""Start Exploring"",""DisplayName"":""Start Exploring"",""Id"":""12767040011"",""IsRoot"":false},{""ContextFreeName"":""Spring Savings on Coleman Camping Gear"",""DisplayName"":""Spring Savings on Coleman Camping Gear"",""Id"":""9103512011"",""IsRoot"":false},{""ContextFreeName"":""Savings Across Coleman"",""DisplayName"":""Savings Across Coleman"",""Id"":""12114505011"",""IsRoot"":false},{""ContextFreeName"":""Great Savings on Coleman Camping & Hiking Gear"",""DisplayName"":""Great Savings on Coleman Camping & Hiking Gear"",""Id"":""9819444011"",""IsRoot"":false},{""ContextFreeName"":""Coleman PBDD"",""DisplayName"":""Coleman PBDD"",""Id"":""212323255011"",""IsRoot"":false},{""ContextFreeName"":""Outdoors PBDD"",""DisplayName"":""Outdoors PBDD"",""Id"":""212329392011"",""IsRoot"":false},{""ContextFreeName"":""Save 10% on Sports & Outdoors"",""DisplayName"":""Save 10% on Sports & Outdoors"",""Id"":""122527268011"",""IsRoot"":false},{""ContextFreeName"":""Get $25 off when you buy $200 of select Sports & Outdoors products"",""DisplayName"":""Get $25 off when you buy $200 of select Sports & Outdoors products"",""Id"":""204390938011"",""IsRoot"":false},{""ContextFreeName"":""Tailgating season"",""DisplayName"":""Tailgating season"",""Id"":""122347023011"",""IsRoot"":false},{""ContextFreeName"":""Bedding & Furniture"",""DisplayName"":""Bedding & Furniture"",""Id"":""19633559011"",""IsRoot"":false}]","{}","Grey & White","Color","en_US",false,"IsAdultProduct","en_US",4,"Height","en_US","inches",31.5,"Length","en_US","inches",14.33,"Weight","en_US","pounds",11,"Width","en_US","inches","56 x 21.3 x 66.1 inches","Size","en_US",1,"NumberOfItems","en_US","USD","In Stock",,"B0CBBZ3J4J",,,,,,,"2010-01-01T00:00:01Z","ReleaseDate","en_US","2010-01-01T00:00:01Z","ReleaseDate","en_US",,,
"B0D7QHY574","Coleman Sundome Camping Tent with Rainfly, 2/3/4/6 Person Tent Sets Up in 10 Mins, Weatherproof Shelter for Camping, Festivals, Backyard, Sleepovers, & More","US","amz-B0D7QHY574","fetched","Coleman Sundome Camping Tent with Rainfly, 2/3/4/6 Person Tent Sets Up in 10 Mins, Weatherproof Shelter for Camping, Festivals, Backyard, Sleepovers, & More","","[""Included rainfly offers extra weather protection"",""Strong frame withstands 35+ mph winds"",""Large windows and a ground vent for superior ventilation"",""E-Port makes it easy to bring electrical power inside"",""Easy setup in 10 minutes"",""Dimensions: 9 x 7 ft"",""Center height: 4 ft. 11 in"",""Fits 1 queen-size air bed"",""1-year limited warranty""]","","B0D7QHY574","[{""ContextFreeName"":""Camping Tents"",""DisplayName"":""Tents"",""Id"":""1258595011"",""IsRoot"":false},{""ContextFreeName"":""Tents & Shelters"",""DisplayName"":""Tents & Shelters"",""Id"":""23566367011"",""IsRoot"":false},{""ContextFreeName"":""Camping & Hiking"",""DisplayName"":""Camping & Hiking"",""Id"":""207963343011"",""IsRoot"":false},{""ContextFreeName"":""fitness markdowns"",""DisplayName"":""fitness markdowns"",""Id"":""211735193011"",""IsRoot"":false},{""ContextFreeName"":""Spring Travel & Adventure Draft"",""DisplayName"":""Spring Travel & Adventure Draft"",""Id"":""206082974011"",""IsRoot"":false}]","https://www.amazon.com/dp/B0D7QHY574?tag=smartymode-20&linkCode=ogi&th=1&psc=1","https://m.media-amazon.com/images/I/41Bn7ikFVsL._SL75_.jpg",75,75,"https://m.media-amazon.com/images/I/41Bn7ikFVsL._SL160_.jpg",160,160,"https://m.media-amazon.com/images/I/41Bn7ikFVsL._SL500_.jpg",500,500,"[{""Small"":{""URL"":""https://m.media-amazon.com/images/I/41IwcldJxbL._SL75_.jpg"",""Height"":75,""Width"":75}},{""Small"":{""URL"":""https://m.media-amazon.com/images/I/51kF5GN8TkL._SL75_.jpg"",""Height"":75,""Width"":75}},{""Small"":{""URL"":""https://m.media-amazon.com/images/I/51hhvND1umL._SL75_.jpg"",""Height"":49,""Width"":75}},{""Small"":{""URL"":""https://m.media-amazon.com/images/I/51WQ2v779ML._SL75_.jpg"",""Height"":49,""Width"":75}}]","[""Included rainfly offers extra weather protection"",""Strong frame withstands 35+ mph winds"",""Large windows and a ground vent for superior ventilation"",""E-Port makes it easy to bring electrical power inside"",""Easy setup in 10 minutes"",""Dimensions: 9 x 7 ft"",""Center height: 4 ft. 11 in"",""Fits 1 queen-size air bed"",""1-year limited warranty""]","Features","en_US","Navy Blue","Color","en_US",,,,23,"Height","en_US","inches",6,"Length","en_US","inches",9.1,"Weight","en_US","Pounds",6,"Width","en_US","inches","PFAS-Free","Size","en_US",1,"NumberOfItems","en_US","Coleman Sundome Camping Tent with Rainfly, 2/3/4/6 Person Tent Sets Up in 10 Mins, Weatherproof Shelter for Camping, Festivals, Backyard, Sleepovers, & More","Title","en_US","[{""Availability"":{""Message"":""In Stock""},""Condition"":{""Value"":""New""},""Id"":""XxWAqiIlne1lBVvzXxW017GDyqbp1VKxg67U%2BgluYp01JHFoFwge0UmRdshhKMsC6FacWOJTHd78RyhTHO2oWMqoQ%2FCsPIixem1vyi1D%2BawFr05RD5dw8VQD80Nd96eFYSoHnGzDXC0kwi1BAg17CQ%3D%3D"",""Price"":{""Amount"":117.94,""Currency"":""USD"",""DisplayAmount"":""$117.94""},""ViolatesMAP"":false}]","[{""Condition"":{""Value"":""New""},""HighestPrice"":{""Amount"":120,""Currency"":""USD"",""DisplayAmount"":""$120.00""}},{""Condition"":{""Value"":""Used""},""HighestPrice"":{""Amount"":79.27,""Currency"":""USD"",""DisplayAmount"":""$79.27""}}]","B0FRNKHVFR",,"2025-12-29T15:40:21.081Z",,"https://m.media-amazon.com/images/I/41Bn7ikFVsL._SL75_.jpg","https://m.media-amazon.com/images/I/41Bn7ikFVsL._SL160_.jpg","https://m.media-amazon.com/images/I/41Bn7ikFVsL._SL500_.jpg","117.94","",,,"[{""ContextFreeName"":""Camping Tents"",""DisplayName"":""Tents"",""Id"":""1258595011"",""IsRoot"":false},{""ContextFreeName"":""Tents & Shelters"",""DisplayName"":""Tents & Shelters"",""Id"":""23566367011"",""IsRoot"":false},{""ContextFreeName"":""Camping & Hiking"",""DisplayName"":""Camping & Hiking"",""Id"":""207963343011"",""IsRoot"":false},{""ContextFreeName"":""fitness markdowns"",""DisplayName"":""fitness markdowns"",""Id"":""211735193011"",""IsRoot"":false},{""ContextFreeName"":""Spring Travel & Adventure Draft"",""DisplayName"":""Spring Travel & Adventure Draft"",""Id"":""206082974011"",""IsRoot"":false}]","{}","Navy Blue","Color","en_US",,,,23,"Height","en_US","inches",6,"Length","en_US","inches",9.1,"Weight","en_US","Pounds",6,"Width","en_US","inches","PFAS-Free","Size","en_US",1,"NumberOfItems","en_US","USD","In Stock",,"B0FRNKHVFR",,,,,,,,,,,,,,,
"B09KNZLDK8","ENO DoubleNest Hammock - Lightweight, Portable, 1 to 2 Person Hammock - for Camping, Hiking, Backpacking, Travel, a Festival, or The Beach - Mountains to Sea/Grey","US","amz-B0D7QHY574","fetched","ENO DoubleNest Hammock - Lightweight, Portable, 1 to 2 Person Hammock - for Camping, Hiking, Backpacking, Travel, a Festival, or The Beach - Mountains to Sea/Grey","","[""Hiking Gear: This lightweight hammock weighs 19 Oz and won't take up too much space in a hiking pack"",""Double Hammock: 9.5' length with 400 lb capacity; ideal camping accessories for women and men"",""Simple Setup: Relax in your hammock anywhere; compatible with all ENO hammock straps and accessories"",""Outdoor-Ready Camping Gear: Durable hammocks built with a triple-stitched seam and breathable nylon"",""Tree-Friendly: ENO is committed to designing responsibly made products for people and the planet""]","","B09KNZLDK8","[{""ContextFreeName"":""Camping Hammocks"",""DisplayName"":""Hammocks"",""Id"":""3143614011"",""IsRoot"":false},{""ContextFreeName"":""Camp Furniture"",""DisplayName"":""Camp Furniture"",""Id"":""23566369011"",""IsRoot"":false}]","https://www.amazon.com/dp/B09KNZLDK8?tag=smartymode-20&linkCode=ogi&th=1&psc=1","https://m.media-amazon.com/images/I/41eHQ3nYFqL._SL75_.jpg",75,75,"https://m.media-amazon.com/images/I/41eHQ3nYFqL._SL160_.jpg",160,160,"https://m.media-amazon.com/images/I/41eHQ3nYFqL._SL500_.jpg",500,500,"[{""Small"":{""URL"":""https://m.media-amazon.com/images/I/41wZvPc0wBL._SL75_.jpg"",""Height"":75,""Width"":75}},{""Small"":{""URL"":""https://m.media-amazon.com/images/I/41zideplxyL._SL75_.jpg"",""Height"":75,""Width"":75}},{""Small"":{""URL"":""https://m.media-amazon.com/images/I/51Xbqnzhu7L._SL75_.jpg"",""Height"":75,""Width"":75}},{""Small"":{""URL"":""https://m.media-amazon.com/images/I/5143o2VsnFL._SL75_.jpg"",""Height"":75,""Width"":75}},{""Small"":{""URL"":""https://m.media-amazon.com/images/I/51RuM6hw4lL._SL75_.jpg"",""Height"":75,""Width"":75}},{""Small"":{""URL"":""https://m.media-amazon.com/images/I/41ss-txsh6L._SL75_.jpg"",""Height"":47,""Width"":75}},{""Small"":{""URL"":""https://m.media-amazon.com/images/I/51-wYplUEKL._SL75_.jpg"",""Height"":49,""Width"":75}},{""Small"":{""URL"":""https://m.media-amazon.com/images/I/41nfzm50b4L._SL75_.jpg"",""Height"":75,""Width"":50}}]","[""Hiking Gear: This lightweight hammock weighs 19 Oz and won't take up too much space in a hiking pack"",""Double Hammock: 9.5' length with 400 lb capacity; ideal camping accessories for women and men"",""Simple Setup: Relax in your hammock anywhere; compatible with all ENO hammock straps and accessories"",""Outdoor-Ready Camping Gear: Durable hammocks built with a triple-stitched seam and breathable nylon"",""Tree-Friendly: ENO is committed to designing responsibly made products for people and the planet""]","Features","en_US","Mountains to Sea | Grey","Color","en_US",,,,0.98818897537,"Height","en_US","Inches",114.17322823,"Length","en_US","Inches",1.18608696956,"Weight","en_US","pounds",75.590551104,"Width","en_US","Inches","9'6"" x 6'4"" / 2.9m x 1.92m","Size","en_US",1,"NumberOfItems","en_US","ENO DoubleNest Hammock - Lightweight, Portable, 1 to 2 Person Hammock - for Camping, Hiking, Backpacking, Travel, a Festival, or The Beach - Mountains to Sea/Grey","Title","en_US","[{""Availability"":{""Message"":""In stock Usually ships within 2 to 3 days.""},""Condition"":{""Value"":""New""},""Id"":""yYnTCzwNjabRk1SQpdyPJqqgrDgZPWnlBZbONV424anW9dNwGIB242n8HzvUlHHnv4zWfVtzyzbHLPg7HRuLhttBatKlqB5NyFQaMLeJBKn2yPcq%2FRsW8Aj4hfbkKDQ5zLz0OFXOUr6ijLvRjFdmeWky9fMMlyvHo2fV2W%2BFqDflq40F0goW4G33nfwrjXz5"",""Price"":{""Amount"":84.95,""Currency"":""USD"",""DisplayAmount"":""$84.95""},""ViolatesMAP"":false}]","[{""Condition"":{""Value"":""New""},""HighestPrice"":{""Amount"":84.95,""Currency"":""USD"",""DisplayAmount"":""$84.95""}}]","B01GTP417C",,"2025-12-29T15:42:58.545Z",,"https://m.media-amazon.com/images/I/41eHQ3nYFqL._SL75_.jpg","https://m.media-amazon.com/images/I/41eHQ3nYFqL._SL160_.jpg","https://m.media-amazon.com/images/I/41eHQ3nYFqL._SL500_.jpg","84.95","",,,"[{""ContextFreeName"":""Camping Hammocks"",""DisplayName"":""Hammocks"",""Id"":""3143614011"",""IsRoot"":false},{""ContextFreeName"":""Camp Furniture"",""DisplayName"":""Camp Furniture"",""Id"":""23566369011"",""IsRoot"":false}]","{}","Mountains to Sea | Grey","Color","en_US",,,,0.98818897537,"Height","en_US","Inches",114.17322823,"Length","en_US","Inches",1.18608696956,"Weight","en_US","pounds",75.590551104,"Width","en_US","Inches","9'6"" x 6'4"" / 2.9m x 1.92m","Size","en_US",1,"NumberOfItems","en_US","USD","In stock Usually ships within 2 to 3 days.",,"B01GTP417C",,,,,,,,,,,,,,,
