"B083BLGRD9","NEMO Fillo Elite Ultralight Pillow | Inflatable Backpacking Pillow for Travel, Backpacking, and Camping, Sapphire Stripe","US","amz-B0D7QHY574","fetched","NEMO Fillo Elite Ultralight Pillow | Inflatable Backpacking Pillow for Travel, Backpacking, and Camping, Sapphire Stripe","","[]","","B083BLGRD9","[{""ContextFreeName"":""Camping Pillows"",""DisplayName"":""Camping Pillows"",""Id"":""3401681"",""IsRoot"":false}]","https://www.amazon.com/dp/B083BLGRD9?tag=smartymode-20&linkCode=ogi&th=1&psc=1","https://m.media-amazon.com/images/I/41P2QqcqycL._SL75_.jpg",63,75,"https://m.media-amazon.com/images/I/41P2QqcqycL._SL160_.jpg",135,160,"https://m.media-amazon.com/images/I/41P2QqcqycL._SL500_.jpg",423,500,"[{""Small"":{""URL"":""https://m.media-amazon.com/images/I/41EbOR6eb5L._SL75_.jpg"",""Height"":63,""Width"":75}},{""Small"":{""URL"":""https://m.media-amazon.com/images/I/31BIu3qjjzL._SL75_.jpg"",""Height"":63,""Width"":75}},{""Small"":{""URL"":""https://m.media-amazon.com/images/I/41mGRi8tV4L._SL75_.jpg"",""Height"":63,""Width"":75}},{""Small"":{""URL"":""https://m.media-amazon.com/images/I/31Xn7zGybdL._SL75_.jpg"",""Height"":63,""Width"":75}},{""Small"":{""URL"":""https://m.media-amazon.com/images/I/31hFS8lzswL._SL75_.jpg"",""Height"":63,""Width"":75}}]",,,,"Blue Flame","Color","en_US",false,"IsAdultProduct","en_US",0.01181102361,"Height","en_US","Inches",2.362204722,"Length","en_US","Inches",0.220462262,"Weight","en_US","pounds",0.787401574,"Width","en_US","Inches","One Size (Pack of 1)","Size","en_US",1,"NumberOfItems","en_US","NEMO Fillo Elite Ultralight Pillow | Inflatable Backpacking Pillow for Travel, Backpacking, and Camping, Sapphire Stripe","Title","en_US","[{""Availability"":{""Message"":""In Stock""},""Condition"":{""Value"":""New""},""Id"":""9zwUs%2F%2BjhcECMAgPAUwzJ5u1zmrE60er9soJii0Pc8ZWc7YhBbgbEcyy%2BoDJDIPwregAtx2PnyKwPbQRFth4PvHs4M9BAZlK8ULKbrkuabileBR8LRYdB%2BRIbofmpUn%2BA7DJhPvJKqso%2F1e5JQIaTgv5VkgMuD8z0nhQwJnNvcG3JAgTJHgr7EvmMPppMqnC"",""Price"":{""Amount"":69,""Currency"":""USD"",""DisplayAmount"":""$69.00""},""ViolatesMAP"":false}]","[{""Condition"":{""Value"":""New""},""HighestPrice"":{""Amount"":69,""Currency"":""USD"",""DisplayAmount"":""$69.00""}}]",,,"2025-12-29T15:41:41.081Z",,"https://m.media-amazon.com/images/I/41P2QqcqycL._SL75_.jpg","https://m.media-amazon.com/images/I/41P2QqcqycL._SL160_.jpg","https://m.media-amazon.com/images/I/41P2QqcqycL._SL500_.jpg","69.00","",,,"[{""ContextFreeName"":""Camping Pillows"",""DisplayName"":""Camping Pillows"",""Id"":""3401681"",""IsRoot"":false}]","{}","Blue Flame","Color","en_US",false,"IsAdultProduct","en_US",0.01181102361,"Height","en_US","Inches",2.362204722,"Length","en_US","Inches",0.220462262,"Weight","en_US","pounds",0.787401574,"Width","en_US","Inches","One Size (Pack of 1)","Size","en_US",1,"NumberOfItems","en_US","USD","In Stock",,"",,,,,,,,,,,,,,,
"B0CWG543T3","Naturehike YL08 Ultralight Camping Chair, 2.38 LBS Portable Backpacking Chair with Anti-Sinking Feet, Lightweight Compact Folding Hiking Camp Chair","US","amz-B0D7QHY574","fetched","Naturehike YL08 Ultralight Camping Chair, 2.38 LBS Portable Backpacking Chair with Anti-Sinking Feet, Lightweight Compact Folding Hiking Camp Chair","","[""⚡ 15-SECOND LIGHTNING SETUP: Snap the aluminum frame together—the internal bungee cord auto-tensions for instant stability. Just attach the seat fabric, and you’re ready to relax in under 15 seconds. No tools, no hassle!"",""💎 AIRCRAFT-GRADE ALUMINUM FRAME: Crafted from ultra-strong 7075 aluminum alloy (67% stronger than standard), our chair’s dual-pole reinforced structure delivers unmatched stability on any terrain. Supports up to 265 lbs."",""😊 ALL-DAY COMFORT TECHNOLOGY: Breathable 600D Oxford fabric with double-stitched seams and side mesh panels prevents overheating. Anti-static coating repels dust and debris—stay clean and comfy for hours."",""📦 ULTRA-LIGHT & TRAVEL-READY: Weighing just 2.38 lbs (1.08kg), carry it one-handed anywhere. Packs into a compact 14.6” x 3.6” bag (included)—fits in backpacks, cars, RVs, or trucks. Adventure lighter!"",""🌟 SMART USER-CENTRIC DESIGN: Detachable anti-sink feet grip sand/mud securely. The carry bag doubles as a frame-mounted storage pouch for phones, keys, or sunglasses—keep essentials within reach!""]","","B0CWG543T3","[{""ContextFreeName"":""Camping Chairs"",""DisplayName"":""Chairs"",""Id"":""3400791"",""IsRoot"":false},{""ContextFreeName"":""Camp Furniture"",""DisplayName"":""Camp Furniture"",""Id"":""23566369011"",""IsRoot"":false},{""ContextFreeName"":""Tailgating season"",""DisplayName"":""Tailgating season"",""Id"":""122347023011"",""IsRoot"":false}]","https://www.amazon.com/dp/B0CWG543T3?tag=smartymode-20&linkCode=ogi&th=1&psc=1","https://m.media-amazon.com/images/I/41y+OZnqGrL._SL75_.jpg",75,75,"https://m.media-amazon.com/images/I/41y+OZnqGrL._SL160_.jpg",160,160,"https://m.media-amazon.com/images/I/41y+OZnqGrL._SL500_.jpg",500,500,"[{""Small"":{""URL"":""https://m.media-amazon.com/images/I/516nJTCYTGL._SL75_.jpg"",""Height"":75,""Width"":75}},{""Small"":{""URL"":""https://m.media-amazon.com/images/I/51CSAP22b1L._SL75_.jpg"",""Height"":75,""Width"":75}},{""Small"":{""URL"":""https://m.media-amazon.com/images/I/51ycNHrStsL._SL75_.jpg"",""Height"":75,""Width"":75}},{""Small"":{""URL"":""https://m.media-amazon.com/images/I/41o1GBtcfBL._SL75_.jpg"",""Height"":75,""Width"":75}},{""Small"":{""URL"":""https://m.media-amazon.com/images/I/51YjcO5Gk-L._SL75_.jpg"",""Height"":75,""Width"":75}},{""Small"":{""URL"":""https://m.media-amazon.com/images/I/51UFNqUfIvL._SL75_.jpg"",""Height"":75,""Width"":75}}]","[""⚡ 15-SECOND LIGHTNING SETUP: Snap the aluminum frame together—the internal bungee cord auto-tensions for instant stability. Just attach the seat fabric, and you’re ready to relax in under 15 seconds. No tools, no hassle!"",""💎 AIRCRAFT-GRADE ALUMINUM FRAME: Crafted from ultra-strong 7075 aluminum alloy (67% stronger than standard), our chair’s dual-pole reinforced structure delivers unmatched stability on any terrain. Supports up to 265 lbs."",""😊 ALL-DAY COMFORT TECHNOLOGY: Breathable 600D Oxford fabric with double-stitched seams and side mesh panels prevents overheating. Anti-static coating repels dust and debris—stay clean and comfy for hours."",""📦 ULTRA-LIGHT & TRAVEL-READY: Weighing just 2.38 lbs (1.08kg), carry it one-handed anywhere. Packs into a compact 14.6” x 3.6” bag (included)—fits in backpacks, cars, RVs, or trucks. Adventure lighter!"",""🌟 SMART USER-CENTRIC DESIGN: Detachable anti-sink feet grip sand/mud securely. The carry bag doubles as a frame-mounted storage pouch for phones, keys, or sunglasses—keep essentials within reach!""]","Features","en_US","Green","Color","en_US",,,,27.952755877,"Height","en_US","inches",12.204724397,"Length","en_US","inches",2.20462262,"Weight","en_US","Pounds",16.141732267,"Width","en_US","inches","Standard","Size","en_US",1,"NumberOfItems","en_US","Naturehike YL08 Ultralight Camping Chair, 2.38 LBS Portable Backpacking Chair with Anti-Sinking Feet, Lightweight Compact Folding Hiking Camp Chair","Title","en_US","[{""Availability"":{""Message"":""In Stock""},""Condition"":{""Value"":""New""},""Id"":""AvyFDXULh7ZpVLO1CbivWIo8%2FaC1X93wRcjz9%2FUjsIHsMnvj9Yfc5yqCfZ32RiROK6syLEbJXJxhEjsr3tUwLA%2FjR3D8psdOs1dttlLx8FiNo31KH9CZ5CcR7ptZP9uGX0nz1n6g%2BHScqkzTdpsM1k1rDtHxVoI%2Bu1qHJJugaBE0JHayNaicfOVPFrk4YeSo"",""Price"":{""Amount"":44.99,""Currency"":""USD"",""DisplayAmount"":""$44.99""},""ViolatesMAP"":false}]","[{""Condition"":{""Value"":""New""},""HighestPrice"":{""Amount"":44.99,""Currency"":""USD"",""DisplayAmount"":""$44.99""}},{""Condition"":{""Value"":""Used""},""HighestPrice"":{""Amount"":40.49,""Currency"":""USD"",""DisplayAmount"":""$40.49""}}]","B0D4LWSR84",,"2025-12-29T15:41:03.335Z",,"https://m.media-amazon.com/images/I/41y+OZnqGrL._SL75_.jpg","https://m.media-amazon.com/images/I/41y+OZnqGrL._SL160_.jpg","https://m.media-amazon.com/images/I/41y+OZnqGrL._SL500_.jpg","44.99","",,,"[{""ContextFreeName"":""Camping Chairs"",""DisplayName"":""Chairs"",""Id"":""3400791"",""IsRoot"":false},{""ContextFreeName"":""Camp Furniture"",""DisplayName"":""Camp Furniture"",""Id"":""23566369011"",""IsRoot"":false},{""ContextFreeName"":""Tailgating season"",""DisplayName"":""Tailgating season"",""Id"":""122347023011"",""IsRoot"":false}]","{}","Green","Color","en_US",,,,27.952755877,"Height","en_US","inches",12.204724397,"Length","en_US","inches",2.20462262,"Weight","en_US","Pounds",16.141732267,"Width","en_US","inches","Standard","Size","en_US",1,"NumberOfItems","en_US","USD","In Stock",,"B0D4LWSR84",,,,,,,,,,,,,,,
"B0DSCM2NDG","Osprey Talon 22L Men's Lightweight Hiking Backpack - Small Daypack for Travel & Camping, White/Black","US","amz-B0D7QHY574","fetched","Osprey Talon 22L Men's Lightweight Hiking Backpack - Small Daypack for Travel & Camping, White/Black","","[""LIGHTWEIGHT & VERSATILE DESIGN: This lightweight 22-liter hiking backpack is built for full-day hikes, biking and travel. It features a fine-tuned design for dynamic movement in all environments and a low-profile fit."",""PRECISE & BREATHABLE FIT: Stay cool and supported with an AirScape backpanel that delivers a close-to-body, stable carry and improves airflow to reduce sweat while hiking or cycling. The adjustable sliding yoke and BioStretch hipbelt create a personalized men's fit, keeping the bag stable and comfortable during hikes, bikes, day trips, and other adventures."",""MULTI-SPORT VERSATILITY: Stow-on-the-Go trekking pole attachment, a LidLock bike helmet attachment and a tuck-away ice ax attachment make this a truly multi-sport pack."",""SMART STORAGE & ORGANIZATION: Keep your essentials for adventure organized with multiple storage options, including dual-zippered hipbelt pockets, a spacious top panel pocket, and stretch mesh side pockets for water bottles."",""HYDRATION COMPATIBLE: Features an internal hydration reservoir sleeve (reservoir not included) so water can be easily stored and accessible while you stay in motion during hikes, bike rides, or other outdoor adventures."",""Item Dimensions: 22H x 11.4W x 11.4D in; Item Weight: 2.38lb""]","","B0DSCM2NDG","[{""ContextFreeName"":""Hiking Daypacks"",""DisplayName"":""Hiking Daypacks"",""Id"":""3400471"",""IsRoot"":false},{""ContextFreeName"":""6609e2df-21bc-475b-90b2-735f42ef982c_3901"",""DisplayName"":""6609e2df-21bc-475b-90b2-735f42ef982c_3901"",""Id"":""119972131011"",""IsRoot"":false},{""ContextFreeName"":""b21c23e8-ac46-41ab-bfed-a824ad1360c0_8501"",""DisplayName"":""b21c23e8-ac46-41ab-bfed-a824ad1360c0_8501"",""Id"":""119972035011"",""IsRoot"":false},{""ContextFreeName"":""Premium Fashion"",""DisplayName"":""Premium Fashion"",""Id"":""118268314011"",""IsRoot"":false}]","https://www.amazon.com/dp/B0DSCM2NDG?tag=smartymode-20&linkCode=ogi&th=1&psc=1","https://m.media-amazon.com/images/I/41gZoRlK3PL._SL75_.jpg",75,56,"https://m.media-amazon.com/images/I/41gZoRlK3PL._SL160_.jpg",160,120,"https://m.media-amazon.com/images/I/41gZoRlK3PL._SL500_.jpg",500,375,"[{""Small"":{""URL"":""https://m.media-amazon.com/images/I/41BSy-auRTL._SL75_.jpg"",""Height"":75,""Width"":75}},{""Small"":{""URL"":""https://m.media-amazon.com/images/I/51KxVGFJXIL._SL75_.jpg"",""Height"":75,""Width"":75}},{""Small"":{""URL"":""https://m.media-amazon.com/images/I/51A2NyfjXJL._SL75_.jpg"",""Height"":75,""Width"":75}},{""Small"":{""URL"":""https://m.media-amazon.com/images/I/41uZqbmR+EL._SL75_.jpg"",""Height"":75,""Width"":75}},{""Small"":{""URL"":""https://m.media-amazon.com/images/I/51a0U8nJW7L._SL75_.jpg"",""Height"":75,""Width"":75}},{""Small"":{""URL"":""https://m.media-amazon.com/images/I/41yGX2uPcgL._SL75_.jpg"",""Height"":75,""Width"":56}},{""Small"":{""URL"":""https://m.media-amazon.com/images/I/31gPirqdZwL._SL75_.jpg"",""Height"":75,""Width"":75}},{""Small"":{""URL"":""https://m.media-amazon.com/images/I/31X0HTfebTL._SL75_.jpg"",""Height"":75,""Width"":75}},{""Small"":{""URL"":""https://m.media-amazon.com/images/I/31vugqX64bL._SL75_.jpg"",""Height"":75,""Width"":75}},{""Small"":{""URL"":""https://m.media-amazon.com/images/I/41fusyFR9tL._SL75_.jpg"",""Height"":75,""Width"":75}},{""Small"":{""URL"":""https://m.media-amazon.com/images/I/41SsKKIaeoL._SL75_.jpg"",""Height"":75,""Width"":75}},{""Small"":{""URL"":""https://m.media-amazon.com/images/I/31e-gUXNRGL._SL75_.jpg"",""Height"":75,""Width"":75}}]","[""LIGHTWEIGHT & VERSATILE DESIGN: This lightweight 22-liter hiking backpack is built for full-day hikes, biking and travel. It features a fine-tuned design for dynamic movement in all environments and a low-profile fit."",""PRECISE & BREATHABLE FIT: Stay cool and supported with an AirScape backpanel that delivers a close-to-body, stable carry and improves airflow to reduce sweat while hiking or cycling. The adjustable sliding yoke and BioStretch hipbelt create a personalized men's fit, keeping the bag stable and comfortable during hikes, bikes, day trips, and other adventures."",""MULTI-SPORT VERSATILITY: Stow-on-the-Go trekking pole attachment, a LidLock bike helmet attachment and a tuck-away ice ax attachment make this a truly multi-sport pack."",""SMART STORAGE & ORGANIZATION: Keep your essentials for adventure organized with multiple storage options, including dual-zippered hipbelt pockets, a spacious top panel pocket, and stretch mesh side pockets for water bottles."",""HYDRATION COMPATIBLE: Features an internal hydration reservoir sleeve (reservoir not included) so water can be easily stored and accessible while you stay in motion during hikes, bike rides, or other outdoor adventures."",""Item Dimensions: 22H x 11.4W x 11.4D in; Item Weight: 2.38lb""]","Features","en_US","White/Black","Color","en_US",false,"IsAdultProduct","en_US",22,"Height","en_US","inches",11.4,"Length","en_US","inches",2.38,"Weight","en_US","Pounds",11.4,"Width","en_US","inches","22L - Standard Fit","Size","en_US",,,,"Osprey Talon 22L Men's Lightweight Hiking Backpack - Small Daypack for Travel & Camping, White/Black","Title","en_US","[{""Availability"":{""Message"":""In Stock""},""Condition"":{""Value"":""New""},""Id"":""yPTfNmlfLUN6Yz6mQX5NGxlukMLLDWgpbcuPWwK3Wc1Ytws5ZczzP%2B2IsljORSXELfSTylCL%2FYfznaXgxi3J1N0m77Wanh8Jy1mNhzZqg1Qgqb12OUwXDI3M58I0uzIPWVNjrjqc1CQPc2Wjd8Gq88O3KS8Y0Aqitdd1hxwCLH9flPcPby1V1A%3D%3D"",""Price"":{""Amount"":155,""Currency"":""USD"",""DisplayAmount"":""$155.00"",""Savings"":{""Amount"":15,""Currency"":""USD"",""DisplayAmount"":""$15.00 (9%)"",""Percentage"":9}},""ViolatesMAP"":false}]","[{""Condition"":{""Value"":""Used""},""HighestPrice"":{""Amount"":119.92,""Currency"":""USD"",""DisplayAmount"":""$119.92""}},{""Condition"":{""Value"":""New""},""HighestPrice"":{""Amount"":160,""Currency"":""USD"",""DisplayAmount"":""$160.00""}}]","B0FYG44KYY",,"2025-12-29T15:43:24.863Z",,"https://m.media-amazon.com/images/I/41gZoRlK3PL._SL75_.jpg","https://m.media-amazon.com/images/I/41gZoRlK3PL._SL160_.jpg","https://m.media-amazon.com/images/I/41gZoRlK3PL._SL500_.jpg","155.00","",,,"[{""ContextFreeName"":""Hiking Daypacks"",""DisplayName"":""Hiking Daypacks"",""Id"":""3400471"",""IsRoot"":false},{""ContextFreeName"":""6609e2df-21bc-475b-90b2-735f42ef982c_3901"",""DisplayName"":""6609e2df-21bc-475b-90b2-735f42ef982c_3901"",""Id"":""119972131011"",""IsRoot"":false},{""ContextFreeName"":""b21c23e8-ac46-41ab-bfed-a824ad1360c0_8501"",""DisplayName"":""b21c23e8-ac46-41ab-bfed-a824ad1360c0_8501"",""Id"":""119972035011"",""IsRoot"":false},{""ContextFreeName"":""Premium Fashion"",""DisplayName"":""Premium Fashion"",""Id"":""118268314011"",""IsRoot"":false}]","{}","White/Black","Color","en_US",false,"IsAdultProduct","en_US",22,"Height","en_US","inches",11.4,"Length","en_US","inches",2.38,"Weight","en_US","Pounds",11.4,"Width","en_US","inches","22L - Standard Fit","Size","en_US",,,,"USD","In Stock",,"B0FYG44KYY",,,,,,,,,,,,,,,
"B0D8JRXNPN","Rumpl Original Puffy Blanket - Warm, Water-Resistant Camping Blanket with 100% Recycled Synthetic Insulation, 52""x75"", Original Puffy V2, Alpenglow","US","amz-B0D7QHY574","fetched","Rumpl Original Puffy Blanket - Warm, Water-Resistant Camping Blanket with 100% Recycled Synthetic Insulation, 52""x75"", Original Puffy V2, Alpenglow","","[""The ultimate outdoor companion, this versatile and packable puffy blanket combines the technical materials of premium sleeping bags and insulated jackets for warmth, durability, and comfort in any environment"",""Crafted with a ripstop shell featuring a PFAS-free durable water-repellent finish for water, stain, and odor resistance; repels dirt, sand, spilled drinks, and pet hair for hassle-free use in any setting"",""Insulated with 100% post-consumer recycled RenewaLoft synthetic insulation for warmth and comfort; 240 gsm fill ensures superior heat retention while remaining lightweight and compressible"",""Features a hands-free Cape Clip for wearable warmth and paracord corner staking loops for securing the blanket to the ground or integrating with the Everywhere Mat for the ultimate outdoor lounging experience"",""Measures 52 x 75 inches (132 x 190 cm) when flat; packs down to 7 x 16 inches (18 x 41 cm); weighs 2.2 lbs (0.99 kg); includes a roll-top stuff sack for convenient portability; machine washable; certified B Corp, Climate Label Certified, and a member of Carbon Neutral and 1% for the Planet""]","","B0D8JRXNPN","[{""ContextFreeName"":""Camping Blankets"",""DisplayName"":""Blankets"",""Id"":""14332921"",""IsRoot"":false}]","https://www.amazon.com/dp/B0D8JRXNPN?tag=smartymode-20&linkCode=ogi&th=1&psc=1","https://m.media-amazon.com/images/I/41FGfVCx7nL._SL75_.jpg",75,75,"https://m.media-amazon.com/images/I/41FGfVCx7nL._SL160_.jpg",160,160,"https://m.media-amazon.com/images/I/41FGfVCx7nL._SL500_.jpg",500,500,"[{""Small"":{""URL"":""https://m.media-amazon.com/images/I/51NjqHwEByL._SL75_.jpg"",""Height"":75,""Width"":75}},{""Small"":{""URL"":""https://m.media-amazon.com/images/I/41IOkFR12KL._SL75_.jpg"",""Height"":75,""Width"":75}},{""Small"":{""URL"":""https://m.media-amazon.com/images/I/51OJeYTuKnL._SL75_.jpg"",""Height"":75,""Width"":75}},{""Small"":{""URL"":""https://m.media-amazon.com/images/I/41tmDc0Eh6L._SL75_.jpg"",""Height"":75,""Width"":75}},{""Small"":{""URL"":""https://m.media-amazon.com/images/I/41Nf-Murr+L._SL75_.jpg"",""Height"":75,""Width"":75}},{""Small"":{""URL"":""https://m.media-amazon.com/images/I/51bp3xgOAjL._SL75_.jpg"",""Height"":75,""Width"":75}},{""Small"":{""URL"":""https://m.media-amazon.com/images/I/51p9botUHjL._SL75_.jpg"",""Height"":75,""Width"":75}},{""Small"":{""URL"":""https://m.media-amazon.com/images/I/51MckTGLyPL._SL75_.jpg"",""Height"":75,""Width"":75}}]","[""The ultimate outdoor companion, this versatile and packable puffy blanket combines the technical materials of premium sleeping bags and insulated jackets for warmth, durability, and comfort in any environment"",""Crafted with a ripstop shell featuring a PFAS-free durable water-repellent finish for water, stain, and odor resistance; repels dirt, sand, spilled drinks, and pet hair for hassle-free use in any setting"",""Insulated with 100% post-consumer recycled RenewaLoft synthetic insulation for warmth and comfort; 240 gsm fill ensures superior heat retention while remaining lightweight and compressible"",""Features a hands-free Cape Clip for wearable warmth and paracord corner staking loops for securing the blanket to the ground or integrating with the Everywhere Mat for the ultimate outdoor lounging experience"",""Measures 52 x 75 inches (132 x 190 cm) when flat; packs down to 7 x 16 inches (18 x 41 cm); weighs 2.2 lbs (0.99 kg); includes a roll-top stuff sack for convenient portability; machine washable; certified B Corp, Climate Label Certified, and a member of Carbon Neutral and 1% for the Planet""]","Features","en_US","Alpenglow","Color","en_US",,,,,,,,,,,,,,,,,,,,"52 x 75 inches","Size","en_US",1,"NumberOfItems","en_US","Rumpl Original Puffy Blanket - Warm, Water-Resistant Camping Blanket with 100% Recycled Synthetic Insulation, 52""x75"", Original Puffy V2, Alpenglow","Title","en_US","[{""Availability"":{""Message"":""In Stock""},""Condition"":{""Value"":""New""},""Id"":""A4EZXH2ScyFGKV8AimYHqyBJp8zRzqNNMpeuXaz6r07%2FJyeQiwLY9eHQgYO%2F%2B4nIRlI%2BNxRdaIPJxFfSvGYiHey7MduWAJ08FxYmKFJAHE1XFFbWxJ0DYQop4p3nSLHq9VTyJdP3tcaFcNGKYIb%2F1r3iNg4%2B%2Fkq0D7lqGVyJc5h0LmDdj6sKkqRtQAH413Ta"",""Price"":{""Amount"":99.95,""Currency"":""USD"",""DisplayAmount"":""$99.95""},""ViolatesMAP"":false}]","[{""Condition"":{""Value"":""New""},""HighestPrice"":{""Amount"":99.95,""Currency"":""USD"",""DisplayAmount"":""$99.95""}}]","B0CJWKS466",,"2025-12-29T15:43:31.560Z",,"https://m.media-amazon.com/images/I/41FGfVCx7nL._SL75_.jpg","https://m.media-amazon.com/images/I/41FGfVCx7nL._SL160_.jpg","https://m.media-amazon.com/images/I/41FGfVCx7nL._SL500_.jpg","99.95","",,,"[{""ContextFreeName"":""Camping Blankets"",""DisplayName"":""Blankets"",""Id"":""14332921"",""IsRoot"":false}]","{}","Alpenglow","Color","en_US",,,,,,,,,,,,,,,,,,,,"52 x 75 inches","Size","en_US",1,"NumberOfItems","en_US","USD","In Stock",,"B0CJWKS466",,,,,,,,,,,,,,,
